{
  "$schema": "https://json-schema.org/draft/2020-12/schema",
  "title": "OpenPhenology postal/1",
  "description": "US ZIP codes sharing a 3-digit prefix, and the counties each falls in.",
  "type": "object",
  "required": [
    "id",
    "kind",
    "format",
    "provenance",
    "data"
  ],
  "properties": {
    "id": {
      "type": "string",
      "minLength": 1
    },
    "kind": {
      "const": "postal"
    },
    "format": {
      "type": "string",
      "pattern": "^postal/1\\.\\d+$"
    },
    "provenance": {
      "type": "object",
      "required": [
        "release",
        "sources",
        "licences",
        "gbif_download_dois",
        "method",
        "taxonomy",
        "boundaries",
        "ranges",
        "protection",
        "code",
        "run"
      ],
      "properties": {
        "release": {
          "type": "string",
          "pattern": "^\\d{4}-\\d{2}-\\d{2}$"
        },
        "sources": {
          "type": "array",
          "items": {
            "type": "string"
          }
        },
        "licences": {
          "type": "array",
          "items": {
            "type": "string"
          }
        },
        "gbif_download_dois": {
          "type": "array",
          "items": {
            "type": "string"
          }
        },
        "method": {
          "anyOf": [
            {
              "type": "string"
            },
            {
              "type": "null"
            }
          ]
        },
        "taxonomy": {
          "anyOf": [
            {
              "type": "string"
            },
            {
              "type": "null"
            }
          ]
        },
        "boundaries": {
          "anyOf": [
            {
              "type": "string"
            },
            {
              "type": "null"
            }
          ]
        },
        "ranges": {
          "anyOf": [
            {
              "type": "array",
              "items": {
                "type": "string"
              }
            },
            {
              "type": "null"
            }
          ]
        },
        "protection": {
          "anyOf": [
            {
              "type": "object",
              "additionalProperties": {
                "type": "string"
              }
            },
            {
              "type": "null"
            }
          ]
        },
        "code": {
          "anyOf": [
            {
              "type": "string"
            },
            {
              "type": "null"
            }
          ]
        },
        "run": {
          "anyOf": [
            {
              "type": "string"
            },
            {
              "type": "null"
            }
          ]
        }
      }
    },
    "data": {
      "type": "object",
      "required": [
        "zips"
      ],
      "properties": {
        "zips": {
          "type": "object",
          "propertyNames": {
            "type": "string",
            "pattern": "^\\d{5}$"
          },
          "additionalProperties": {
            "type": "array",
            "items": {
              "type": "array",
              "prefixItems": [
                {
                  "type": "string",
                  "pattern": "^\\d{5}$"
                },
                {
                  "type": "number",
                  "minimum": 0,
                  "maximum": 1
                }
              ],
              "items": false,
              "minItems": 2
            },
            "minItems": 1
          }
        }
      }
    }
  }
}
